{
  "$schema": "http://json-schema.org/draft-07/schema#",
  "title": "workflow.config.json",
  "description": "リリースワークフローエンジン(.claude/workflows/*.js)が読み込むプロジェクト固有設定のスキーマ。エンジン本体はプロジェクト中立とし、固有値(検査コマンド・レビュープロンプト・文書パス等)はすべてこの config に置く。信頼境界: checks[].cmd は任意シェルコマンドとして実行され、reviewDimensions[].prompt・syncDocs.targets[].instruction はエージェントへの指示として無検証で展開される。このファイルは .claude/workflows/*.js 本体と同じ信頼レベル(リポジトリにコミットされ、通常の PR レビューでのみ変更される)を前提とする。外部入力や未レビューの変更を書き込んではならない。configVersion の互換性は前方向のみ保証する(同一 configVersion 内でのスキーマへの optional フィールド追加は、新エンジン+新スキーマが旧 config を読める形でのみ行い、旧エンジン+旧スキーマ(このファイルの過去バージョン)が新しい config を検証できることは保証しない)。エンジン・スキーマ・config は install/update-release-workflow の正規フローでは常に同時に更新されるため通常は問題にならないが、手動でエンジン・スキーマだけを過去バージョンへ戻しつつ config を新しいまま残すような操作は非サポートである",
  "type": "object",
  "additionalProperties": false,
  "required": [
    "configVersion",
    "language",
    "baseBranch",
    "requirementsPath",
    "conventionsDoc",
    "checks",
    "reviewDimensions",
    "diffPathScope",
    "syncDocs",
    "knownIssues",
    "models",
    "complexityRubricExamples",
    "automation",
    "templateVersion",
    "installedAt"
  ],
  "definitions": {
    "model": {
      "type": "string",
      "description": "モデル指定。ティア名(haiku/sonnet/opus/fable)または完全モデル ID(例: claude-opus-5-5、claude-sonnet-5、claude-haiku-4-5-20251001)の両対応。バージョン固定したい場合は完全 ID を使う",
      "pattern": "^(haiku|sonnet|opus|fable|claude-[a-z0-9][a-z0-9.-]*)$"
    },
    "effort": {
      "type": "string",
      "description": "思考の深さ。low < medium < high < xhigh < max の順に深く、費用も増える。haiku 系のモデルには付けても無視される(API が受け付けないため、エンジンが付けない)",
      "enum": ["low", "medium", "high", "xhigh", "max"]
    },
    "severity": {
      "type": "string",
      "enum": ["critical", "high", "medium", "low"]
    },
    "relativePath": {
      "type": "string",
      "description": "リポジトリルート起点の相対パス(絶対パス禁止)",
      "minLength": 1,
      "pattern": "^[^/]"
    },
    "categoryPrefix": {
      "type": "string",
      "description": "known-issues の起票 ID カテゴリ接頭辞(例: B, P, A, S, L, N)",
      "pattern": "^[A-Z]$"
    }
  },
  "properties": {
    "configVersion": {
      "const": 1,
      "description": "config 形式の版数。エンジン要求版と一致しない場合、エンジンは起動を拒否する"
    },
    "language": {
      "type": "string",
      "enum": ["ja", "en"],
      "description": "プロンプト言語。現状はどのエンジンも参照せず、全プロンプトは日本語ハードコードのまま。en は将来の英語化実装のための予約値であり、設定しても挙動は変わらない"
    },
    "baseBranch": {
      "type": "string",
      "minLength": 1,
      "description": "差分比較・PR 先の基底ブランチ。エンジンはこのブランチへ直接 push しない"
    },
    "requirementsPath": {
      "type": "string",
      "pattern": "\\{release\\}",
      "description": "要件ファイルのパステンプレート。{release} プレースホルダ必須"
    },
    "conventionsDoc": {
      "$ref": "#/definitions/relativePath",
      "description": "実装・レビューが参照する規約ドキュメント"
    },
    "checks": {
      "type": "array",
      "minItems": 1,
      "description": "release-check が並列実行する検査コマンド群",
      "items": {
        "type": "object",
        "additionalProperties": false,
        "required": ["key", "cmd", "cwd"],
        "properties": {
          "key": {
            "type": "string",
            "pattern": "^[a-z][a-z0-9_-]*$",
            "description": "検査の識別子(known-issues 起票時は check:<key> として categoryMap を引く)"
          },
          "cmd": { "type": "string", "minLength": 1 },
          "cwd": {
            "type": "string",
            "minLength": 1,
            "description": "コマンドの実行ディレクトリ(リポジトリルート相対。ルートなら \".\")"
          }
        }
      }
    },
    "reviewDimensions": {
      "type": "array",
      "minItems": 1,
      "description": "review-changes の並列レビュー次元。prompt には差分特定の前置きをエンジンが付与するため、観点の指示のみ書く",
      "items": {
        "type": "object",
        "additionalProperties": false,
        "required": ["key", "prompt"],
        "properties": {
          "key": {
            "type": "string",
            "pattern": "^[a-z][a-z0-9_-]*$",
            "description": "次元の識別子(known-issues 起票時に categoryMap を引くキー)"
          },
          "prompt": { "type": "string", "minLength": 1 }
        }
      }
    },
    "diffPathScope": {
      "type": ["string", "array", "null"],
      "description": "レビュー(review-changes)の差分取得をパスで絞り込む(モノレポ用)。config=プロジェクト既定(恒常フィルタ)、args=呼び出し単位の上書き(args 優先)、両方 null なら全差分。sync-docs はこの値を参照しない(同期対象の絞り込みは関連性トリアージが担う)",
      "items": { "type": "string", "minLength": 1 }
    },
    "syncDocs": {
      "type": "object",
      "additionalProperties": false,
      "required": ["targets", "frozen", "excluded"],
      "properties": {
        "targets": {
          "type": "array",
          "minItems": 1,
          "description": "実装差分を同期するドキュメントと、その同期方針の指示",
          "items": {
            "type": "object",
            "additionalProperties": false,
            "required": ["path", "instruction"],
            "properties": {
              "path": { "$ref": "#/definitions/relativePath" },
              "instruction": { "type": "string", "minLength": 1 }
            }
          }
        },
        "frozen": {
          "type": "array",
          "description": "凍結済み文書(同期対象外であることを明示するリスト)",
          "items": { "$ref": "#/definitions/relativePath" }
        },
        "excluded": {
          "type": "array",
          "description": "意図的に同期しない文書",
          "items": { "$ref": "#/definitions/relativePath" }
        }
      }
    },
    "knownIssues": {
      "type": "object",
      "additionalProperties": false,
      "required": ["path", "categoryMap", "defaultCategory"],
      "properties": {
        "path": { "$ref": "#/definitions/relativePath" },
        "categoryMap": {
          "type": "object",
          "description": "所見種別(レビュー次元 key または check:<検査 key>)→起票 ID カテゴリ接頭辞。マップ外は defaultCategory を使う",
          "minProperties": 1,
          "propertyNames": {
            "pattern": "^[a-z][a-z0-9_-]*(:[a-z][a-z0-9_-]*)?$"
          },
          "additionalProperties": { "$ref": "#/definitions/categoryPrefix" }
        },
        "defaultCategory": { "$ref": "#/definitions/categoryPrefix" }
      }
    },
    "models": {
      "type": "object",
      "description": "工程ロール別のモデル割当。追加ロールも model 形式なら許容する。推奨(エンジンの既定値): design / verify / fix / review / implementHigh = opus、implementMid / implementLow / explore / docSync / codex = sonnet、check / bootstrap = haiku",
      "required": [
        "review",
        "verify",
        "explore",
        "design",
        "implementLow",
        "implementMid",
        "implementHigh",
        "check",
        "fix",
        "docSync",
        "bootstrap"
      ],
      "properties": {
        "review": {
          "$ref": "#/definitions/model",
          "description": "差分レビュー(次元レビューエージェント)"
        },
        "verify": {
          "$ref": "#/definitions/model",
          "description": "所見の敵対的検証"
        },
        "explore": {
          "$ref": "#/definitions/model",
          "description": "既存コードの調査"
        },
        "design": {
          "$ref": "#/definitions/model",
          "description": "実装計画の設計"
        },
        "implementLow": {
          "$ref": "#/definitions/model",
          "description": "実装(複雑度スコア低: 機械的な変更)"
        },
        "implementMid": {
          "$ref": "#/definitions/model",
          "description": "実装(複雑度スコア中: 典型的な実装)"
        },
        "implementHigh": {
          "$ref": "#/definitions/model",
          "description": "実装(複雑度スコア高: 新規設計判断を伴う)"
        },
        "check": {
          "$ref": "#/definitions/model",
          "description": "検査コマンドの実行と結果報告"
        },
        "fix": {
          "$ref": "#/definitions/model",
          "description": "検査・レビュー失敗の修正(run-release の修正ループ)"
        },
        "codex": {
          "$ref": "#/definitions/model",
          "description": "Codex の検出と一次レビュー実行(Codex CLI を呼ぶだけの体)。省略時は sonnet"
        },
        "docSync": {
          "$ref": "#/definitions/model",
          "description": "ドキュメント同期・PR 本文・既知課題の起票・コミット分割案とコミット実行"
        },
        "bootstrap": {
          "$ref": "#/definitions/model",
          "description": "転記と実行だけの軽量工程(状態保存・スナップショット・変更マップ・push・PR 作成・通知等)。config 読込体だけは構造上この値を参照できず 'haiku' 固定(鶏と卵)"
        }
      },
      "additionalProperties": { "$ref": "#/definitions/model" }
    },
    "efforts": {
      "type": "object",
      "description": "工程ロール別の effort(キーは models と同じロール名)。省略したロールはエンジンの既定値: design / verify / fix / review / implementHigh = high、implementMid / explore / docSync = medium、implementLow / codex = low。check / bootstrap は既定が haiku なので付かない(haiku 系のモデルには指定しても付けない)",
      "additionalProperties": { "$ref": "#/definitions/effort" }
    },
    "complexityRubricExamples": {
      "type": "object",
      "description": "実装作業項目の複雑度採点(1-10)を較正するプロジェクト固有の具体例。汎用ルーブリック本文はエンジン側が持つ",
      "additionalProperties": false,
      "required": ["low", "mid", "high"],
      "properties": {
        "low": {
          "type": "string",
          "minLength": 1,
          "description": "複雑度 1-3 の具体例(機械的な置換・定数値の変更・定型パターンのそのままの適用)"
        },
        "mid": {
          "type": "string",
          "minLength": 1,
          "description": "複雑度 4-7 の具体例(既存パターンの組み合わせ・中程度の分岐)"
        },
        "high": {
          "type": "string",
          "minLength": 1,
          "description": "複雑度 8-10 の具体例(新規のアーキテクチャ判断・複雑な状態管理・新規ロジック)"
        }
      }
    },
    "automation": {
      "type": "object",
      "additionalProperties": false,
      "required": [
        "pipeline",
        "autoApprove",
        "maxFixIterationsCheck",
        "maxFixIterationsReview",
        "maxGate1RerunsPerReviewFix",
        "maxTotalCheckRuns",
        "maxAgentInvocations",
        "severityGate"
      ],
      "properties": {
        "pipeline": {
          "type": "string",
          "enum": ["auto", "ask"],
          "description": "要件確定後の run-release 自動起動。auto=確認なしで起動 / ask=起動確認を挟む"
        },
        "autoApprove": {
          "type": "boolean",
          "description": "true なら run-release 内で論理単位コミットまで自動実行(ユーザーによるコミット一括承認とみなす)"
        },
        "createPr": {
          "type": "boolean",
          "description": "false なら PR を作成せず push まで実行し、PR タイトル・本文案を戻り値で返して手動作成に委ねる(gh CLI の認証アカウントがリモートへアクセスできない環境向け)。省略時 true"
        },
        "maxFixIterationsCheck": {
          "type": "integer",
          "minimum": 0,
          "description": "Gate 1(検査ループ)の修正試行上限"
        },
        "maxFixIterationsReview": {
          "type": "integer",
          "minimum": 0,
          "description": "Gate 2(レビューループ)の修正試行上限"
        },
        "maxGate1RerunsPerReviewFix": {
          "type": "integer",
          "minimum": 0,
          "description": "レビュー修正 1 回あたりの Gate 1 再実行の別枠上限"
        },
        "maxTotalCheckRuns": {
          "type": "integer",
          "minimum": 1,
          "description": "release-check の全工程通算実行回数の上限"
        },
        "maxAgentInvocations": {
          "type": "integer",
          "minimum": 1,
          "description": "全工程通算のエージェント起動数上限(超過は収束不能と同じ停止経路)。**この値は子ワークフローが返す実起動数で数える**(0.6.0 で下限推定から実数へ変更)。予算の 8 割に達した時点で任意工程(文書同期・既知課題の解決判定)を省き、PR 作成までは到達させる。目安: 中規模リリース(実装 10 項目前後・レビュー 6 次元)で 250〜300。旧版の値のまま運用していると、実数化により従来完走していた規模が途中停止しうるので引き上げること"
        },
        "knownFindingsLimit": {
          "type": "integer",
          "minimum": 0,
          "description": "レビュー次元へ「再報告するな」として渡す既知所見の件数上限(省略時 60)。台帳はプロンプトに乗るため「バイト数 × ターン数」で課金される。上限超過分は severity の高い順に切る。0 で台帳による抑制を無効化"
        },
        "maxFindingsPerFix": {
          "type": "integer",
          "minimum": 1,
          "description": "Gate2 の修正エージェント 1 体に渡す所見の上限(省略時 2。0.7.0 で 4 → 2 に変更)。1 体のターン数が伸びるとそれまでの全 tool_result の再送が効くため分割する。同一ファイルの所見は上限を超えても同じグループへまとめる(コード読解を共有するため)。上限 4 では 4 件グループが 256 ターン(68.8M)を消費した実測があり、1 件あたりの重さの差を件数上限では吸収できない"
        },
        "maxToolCallsPerAgent": {
          "type": "integer",
          "minimum": 0,
          "description": "実装・修正エージェント 1 体のツール呼び出しの目安(省略時 60、0 で無効)。ランタイムに maxTurns 相当は無いため、エージェント自身に「約この回数で切り上げて残作業を報告する」よう指示し、続きは別の体が引き継ぐ(ソフト上限。遵守率は engine/tools/usage-report.py の turns/agent で確かめること)。1 体の会話が伸びるほど毎ターンのコストが二乗で増えるため、引き継ぎで床から再スタートさせる"
        },
        "maxAgentContinuations": {
          "type": "integer",
          "minimum": 0,
          "description": "1 作業単位 / 1 修正グループあたりの引き継ぎ回数の上限(省略時 2)。最後の引き継ぎ先はソフト上限を外して完走させる(0 なら最初の体から上限なし)。それでも実装が未完なら failedItems に残作業つきで載り、run-release の Gate 0.5 リトライが拾う。修正が未完なら申告済みの所見だけを結果とし、未申告の block 所見は次ラウンドへ持ち越される"
        },
        "maxFilesPerWorkItem": {
          "type": "integer",
          "minimum": 0,
          "description": "実装の 1 作業単位が触るファイル数の上限(省略時 4、0 で無効)。設計出力でこれを超える項目に subtasks が無ければ、その項目だけを対象に再設計(分割)を 1 回だけ行う。エージェントはターン数を見積もれない(「30〜40 ターン」の目安は 10 FR → 16 単位・平均 174 ターンだった)ため、機械的に判定できるファイル数を基準にする"
        },
        "stateDir": {
          "type": "string",
          "minLength": 1,
          "description": "run の中間成果物(変更マップ・チェックポイント state.json)を置くディレクトリ。省略時は ${TMPDIR:-/tmp}/claude-release-workflow/<リポジトリ名>/<release>。**リポジトリ内を指定してはならない** — Gate 0 のクリーンツリー検査と実装工程の捏造検知を壊す。state.json には工程名(phase)・フェーズ別消費・周ごとの Codex 委譲状態も記録され、セッション制限で run が落ちたときの手動完走の起点になる(0.7.0〜)"
        },
        "severityGate": {
          "type": "object",
          "additionalProperties": false,
          "required": ["block", "fixOnce", "backlogOnly"],
          "description": "confirmed 所見の severity 別の扱い。block=修正ループでブロック / fixOnce=修正 1 回試行後に起票 / backlogOnly=起票のみ",
          "properties": {
            "block": {
              "type": "array",
              "uniqueItems": true,
              "items": { "$ref": "#/definitions/severity" }
            },
            "fixOnce": {
              "type": "array",
              "uniqueItems": true,
              "items": { "$ref": "#/definitions/severity" }
            },
            "backlogOnly": {
              "type": "array",
              "uniqueItems": true,
              "items": { "$ref": "#/definitions/severity" }
            }
          }
        }
      }
    },
    "templateVersion": {
      "type": ["string", "null"],
      "description": "導入元テンプレートリポジトリの版。テンプレート未経由(開発元リポジトリ等)は null"
    },
    "installedAt": {
      "type": ["string", "null"],
      "description": "テンプレート導入日(YYYY-MM-DD)。テンプレート未経由は null"
    },
    "codexReview": {
      "type": "object",
      "additionalProperties": false,
      "description": "レビュー次元(review-changes)の一次生成を OpenAI Codex CLI(Claude Code プラグイン codex@<marketplace>、未導入・未認証・失敗時は自動的に通常の自力レビューへフォールバック)へ任意で委譲する設定。省略時は未委譲(常に自力レビュー)として扱う",
      "properties": {
        "enabled": {
          "type": "boolean",
          "description": "true の場合、すべてのレビュー呼び出しで Codex への委譲を試みる(0.6.0 以前は diffPathScope が null のときだけで、Gate2 の 2 巡目以降は構造的に委譲されなかった。現在はスコープ指定時も Codex には全差分を見せ、返った所見をエンジン側でパス濾過する)。準備フェーズで利用可否を 1 回検出し、利用可能なら**全次元の観点を 1 つの focus text に連結した adversarial-review を 1 周 1〜2 コマンド**で実行する(0.7.0〜。作業ツリーに未コミット変更があれば working-tree 差分、base より先行したコミットも併存すれば --base 比較との 2 コマンド併用、クリーンなら --base 比較)。Codex が所見を返した周は次元ごとのレビューエージェント(models.review)を起動せず、所見の次元付けはクラスタリング体が行う(観点に当たらない所見は dimension \"codex\" となり knownIssues.defaultCategory で起票される)。利用枠切れ(usage limit)を検出した周以降は run 単位で試行を省き、戻り値 codexReview と PR 本文にその旨が載る。Codex 未導入・認証未了・呼び出し失敗など、いかなる理由であっても自動的に全次元の自力レビューへフォールバックする(このフラグは委譲の許可であって、Codex が必ず使われることを保証しない)"
        }
      }
    },
    "report": {
      "type": "object",
      "additionalProperties": false,
      "description": "run-release 完了・停止後の HTML 解説レポート(/explain-release)の設定。省略時は有効・既定の出力先。エンジン(.js)は参照せず、コマンドだけが読む",
      "properties": {
        "enabled": {
          "type": "boolean",
          "description": "false なら /run-release・/refine-requirements は完了後に解説レポートを生成しない(/explain-release の単独実行は可能)。省略時 true"
        },
        "outputDir": {
          "type": "string",
          "minLength": 1,
          "description": "レポートの出力先ディレクトリ(<outputDir>/<release>/report.html)。省略時は run の state ディレクトリ。リポジトリ内を指す場合は gitignore 対象であること(未追跡ファイルは次回 Gate 0 のクリーンツリー検査で拒否される)"
        }
      }
    }
  }
}
